{"$id":"urn:dildovander:effects:1","$schema":"https://json-schema.org/draft/2020-12/schema","additionalProperties":false,"description":"V1 authors main/short legacy presentation adapters and explicit opt-in accents; new arbitrary presentation scenes are unsupported and rejected.","properties":{"audio_status":{"maxLength":1024,"minLength":1,"type":"string"},"calibrated":{"enum":[false]},"channels":{"items":{"additionalProperties":false,"properties":{"compartment":{"maximum":36,"minimum":0,"type":"integer"},"led_count":{"maximum":36,"minimum":0,"type":"integer"},"led_first":{"maximum":36,"minimum":0,"type":"integer"},"servo":{"maximum":36,"minimum":0,"type":"integer"},"vibration":{"maximum":36,"minimum":0,"type":"integer"}},"required":["compartment","servo","vibration","led_first","led_count"],"type":"object"},"maxItems":6,"minItems":6,"type":"array"},"count":{"maximum":6,"minimum":6,"type":"integer"},"illustrative_travel_ms":{"maximum":65535,"minimum":1,"type":"integer"},"leds_per_compartment":{"maximum":6,"minimum":6,"type":"integer"},"main":{"items":{"additionalProperties":false,"properties":{"audio":{"enum":[null,"local_tone"]},"duration_ms":{"maximum":65535,"minimum":1,"type":"integer"},"light":{"items":{"maximum":255,"minimum":0,"type":"integer"},"maxItems":3,"minItems":3,"type":"array"},"motion":{"enum":[null,"raise","lower"]},"phase":{"maxLength":128,"minLength":1,"type":"string"},"stage":{"enum":["prepare","raise","show","lower","rest"]},"target":{"oneOf":[{"maximum":6,"minimum":1,"type":"integer"},{"enum":["selected","next","previous"]}]},"tone_hz":{"maximum":2000,"minimum":0,"type":"integer"},"vibration":{"type":"boolean"}},"required":["audio","duration_ms","light","motion","phase","stage","target","vibration"],"type":"object"},"maxItems":104,"minItems":5,"type":"array"},"max_brightness":{"maximum":64,"minimum":64,"type":"integer"},"reveal_tone_hz":{"maximum":2000,"minimum":80,"type":"integer"},"revision":{"maxLength":1024,"minLength":1,"type":"string"},"sceneVersion":{"maximum":65535,"minimum":1,"type":"integer"},"scenes":{"items":{"additionalProperties":false,"properties":{"defaultEnabled":{"enum":[false]},"kind":{"enum":["accent"]},"maxDurationMs":{"maximum":15000,"minimum":1,"type":"integer"},"optionalCapabilities":{"items":{"enum":["led","vibration","audio.tone","calibrated-motion","upstream-dv11"]},"maxItems":5,"minItems":0,"type":"array"},"phases":{"items":{"additionalProperties":false,"properties":{"completion":{"oneOf":[{"additionalProperties":false,"properties":{"durationMs":{"maximum":65535,"minimum":1,"type":"integer"},"kind":{"enum":["elapsed"]}},"required":["kind","durationMs"],"type":"object"},{"additionalProperties":false,"properties":{"direction":{"enum":["raise","lower"]},"kind":{"enum":["calibrated-move"]},"target":{"enum":["selection"]}},"required":["kind","direction","target"],"type":"object"}]},"cues":{"items":{"oneOf":[{"additionalProperties":false,"properties":{"group":{"oneOf":[{"additionalProperties":false,"properties":{"binding":{"enum":["selection","next","previous"]}},"required":["binding"],"type":"object"},{"additionalProperties":false,"properties":{"slot":{"maximum":6,"minimum":1,"type":"integer"}},"required":["slot"],"type":"object"}]},"id":{"maxLength":64,"minLength":1,"pattern":"^[a-z][a-z0-9-]*$","type":"string"},"importance":{"enum":["required","optional"]},"kind":{"enum":["led.solid"]},"latePolicy":{"enum":["sample-current","skip-if-late","abort-show"]},"level":{"maximum":64,"minimum":0,"type":"integer"},"onUnavailable":{"enum":["reject","skip"]},"rgb":{"items":{"maximum":255,"minimum":0,"type":"integer"},"maxItems":3,"minItems":3,"type":"array"},"timing":{"additionalProperties":false,"properties":{"end":{"oneOf":[{"additionalProperties":false,"properties":{"kind":{"enum":["phase-end"]}},"required":["kind"],"type":"object"},{"additionalProperties":false,"properties":{"durationMs":{"maximum":65535,"minimum":1,"type":"integer"},"kind":{"enum":["duration"]}},"required":["kind","durationMs"],"type":"object"}]},"offsetMs":{"maximum":65535,"minimum":0,"type":"integer"}},"required":["offsetMs","end"],"type":"object"}},"required":["id","timing","importance","onUnavailable","latePolicy","kind","group","rgb","level"],"type":"object"},{"additionalProperties":false,"properties":{"fromRgb":{"items":{"maximum":255,"minimum":0,"type":"integer"},"maxItems":3,"minItems":3,"type":"array"},"group":{"oneOf":[{"additionalProperties":false,"properties":{"binding":{"enum":["selection","next","previous"]}},"required":["binding"],"type":"object"},{"additionalProperties":false,"properties":{"slot":{"maximum":6,"minimum":1,"type":"integer"}},"required":["slot"],"type":"object"}]},"id":{"maxLength":64,"minLength":1,"pattern":"^[a-z][a-z0-9-]*$","type":"string"},"importance":{"enum":["required","optional"]},"kind":{"enum":["led.fade"]},"latePolicy":{"enum":["sample-current","skip-if-late","abort-show"]},"level":{"maximum":64,"minimum":0,"type":"integer"},"onUnavailable":{"enum":["reject","skip"]},"rgb":{"items":{"maximum":255,"minimum":0,"type":"integer"},"maxItems":3,"minItems":3,"type":"array"},"timing":{"additionalProperties":false,"properties":{"end":{"oneOf":[{"additionalProperties":false,"properties":{"kind":{"enum":["phase-end"]}},"required":["kind"],"type":"object"},{"additionalProperties":false,"properties":{"durationMs":{"maximum":65535,"minimum":1,"type":"integer"},"kind":{"enum":["duration"]}},"required":["kind","durationMs"],"type":"object"}]},"offsetMs":{"maximum":65535,"minimum":0,"type":"integer"}},"required":["offsetMs","end"],"type":"object"}},"required":["id","timing","importance","onUnavailable","latePolicy","kind","group","rgb","level","fromRgb"],"type":"object"},{"additionalProperties":false,"properties":{"group":{"oneOf":[{"additionalProperties":false,"properties":{"binding":{"enum":["selection","next","previous"]}},"required":["binding"],"type":"object"},{"additionalProperties":false,"properties":{"slot":{"maximum":6,"minimum":1,"type":"integer"}},"required":["slot"],"type":"object"}]},"id":{"maxLength":64,"minLength":1,"pattern":"^[a-z][a-z0-9-]*$","type":"string"},"importance":{"enum":["required","optional"]},"kind":{"enum":["vibration.pulse"]},"latePolicy":{"enum":["sample-current","skip-if-late","abort-show"]},"onUnavailable":{"enum":["reject","skip"]},"timing":{"additionalProperties":false,"properties":{"end":{"oneOf":[{"additionalProperties":false,"properties":{"kind":{"enum":["phase-end"]}},"required":["kind"],"type":"object"},{"additionalProperties":false,"properties":{"durationMs":{"maximum":65535,"minimum":1,"type":"integer"},"kind":{"enum":["duration"]}},"required":["kind","durationMs"],"type":"object"}]},"offsetMs":{"maximum":65535,"minimum":0,"type":"integer"}},"required":["offsetMs","end"],"type":"object"}},"required":["id","timing","importance","onUnavailable","latePolicy","kind","group"],"type":"object"},{"additionalProperties":false,"properties":{"frequencyHz":{"maximum":2000,"minimum":80,"type":"integer"},"id":{"maxLength":64,"minLength":1,"pattern":"^[a-z][a-z0-9-]*$","type":"string"},"importance":{"enum":["required","optional"]},"kind":{"enum":["audio.tone"]},"latePolicy":{"enum":["sample-current","skip-if-late","abort-show"]},"onUnavailable":{"enum":["reject","skip"]},"timing":{"additionalProperties":false,"properties":{"end":{"oneOf":[{"additionalProperties":false,"properties":{"kind":{"enum":["phase-end"]}},"required":["kind"],"type":"object"},{"additionalProperties":false,"properties":{"durationMs":{"maximum":65535,"minimum":1,"type":"integer"},"kind":{"enum":["duration"]}},"required":["kind","durationMs"],"type":"object"}]},"offsetMs":{"maximum":65535,"minimum":0,"type":"integer"}},"required":["offsetMs","end"],"type":"object"}},"required":["id","timing","importance","onUnavailable","latePolicy","kind","frequencyHz"],"type":"object"}]},"maxItems":8,"minItems":0,"type":"array"},"id":{"maxLength":64,"minLength":1,"pattern":"^[a-z][a-z0-9-]*$","type":"string"}},"required":["id","completion","cues"],"type":"object"},"maxItems":64,"minItems":1,"type":"array"},"requiredCapabilities":{"items":{"enum":["led","vibration","audio.tone","calibrated-motion","upstream-dv11"]},"maxItems":5,"minItems":0,"type":"array"},"resourcePolicy":{"enum":["profile-b-single"]},"sceneId":{"maxLength":64,"minLength":1,"pattern":"^[a-z][a-z0-9-]*$","type":"string"},"sceneVersion":{"maximum":65535,"minimum":1,"type":"integer"},"schemaVersion":{"enum":[1]},"trigger":{"enum":["explicit-only"]},"variant":{"maxLength":64,"minLength":1,"pattern":"^[a-z][a-z0-9-]*$","type":"string"}},"required":["schemaVersion","sceneId","sceneVersion","variant","kind","maxDurationMs","trigger","defaultEnabled","resourcePolicy","requiredCapabilities","optionalCapabilities","phases"],"type":"object"},"maxItems":14,"minItems":0,"type":"array"},"schemaVersion":{"enum":[1]},"short":{"items":{"additionalProperties":false,"properties":{"audio":{"enum":[null,"local_tone"]},"duration_ms":{"maximum":65535,"minimum":1,"type":"integer"},"light":{"items":{"maximum":255,"minimum":0,"type":"integer"},"maxItems":3,"minItems":3,"type":"array"},"motion":{"enum":[null,"raise","lower"]},"phase":{"maxLength":128,"minLength":1,"type":"string"},"stage":{"enum":["prepare","raise","show","lower","rest"]},"target":{"oneOf":[{"maximum":6,"minimum":1,"type":"integer"},{"enum":["selected","next","previous"]}]},"tone_hz":{"maximum":2000,"minimum":0,"type":"integer"},"vibration":{"type":"boolean"}},"required":["audio","duration_ms","light","motion","phase","stage","target","vibration"],"type":"object"},"maxItems":104,"minItems":5,"type":"array"},"show_ms":{"maximum":65535,"minimum":1,"type":"integer"},"stop":{"maxLength":1024,"minLength":1,"type":"string"},"transport":{"maxLength":1024,"minLength":1,"type":"string"}},"required":["schemaVersion","sceneVersion","revision","count","leds_per_compartment","max_brightness","main","short","show_ms","reveal_tone_hz","calibrated","illustrative_travel_ms","audio_status","stop","transport","channels","scenes"],"type":"object"}
